{
  "schemaVersion": 1,
  "documentType": "holiday_catalog",
  "jurisdiction": {
    "country": "JP",
    "subdivision": null
  },
  "kind": "official",
  "updatedAt": "2026-08-13T00:00:00Z",
  "sources": [
    {
      "id": "jp-cabinet-office",
      "title": "国民の祝日について",
      "authority": "内閣府",
      "url": "https://www8.cao.go.jp/chosei/shukujitsu/gaiyou.html"
    }
  ],
  "entries": [
    {
      "id": "jp.new-years-day",
      "title": "元日",
      "icon": "🎍",
      "categoryId": "le-chinh-thuc",
      "rule": {
        "kind": "solar_fixed",
        "month": 1,
        "day": 1
      },
      "effective": {
        "fromYear": 1948
      },
      "sourceIds": ["jp-cabinet-office"],
      "leavePolicy": {
        "kind": "same_day"
      }
    },
    {
      "id": "jp.coming-of-age-day",
      "title": "成人の日",
      "icon": "👘",
      "categoryId": "le-chinh-thuc",
      "rule": {
        "kind": "solar_nth_weekday",
        "month": 1,
        "weekday": 1,
        "occurrence": 2
      },
      "effective": {
        "fromYear": 2000
      },
      "sourceIds": ["jp-cabinet-office"],
      "leavePolicy": {
        "kind": "same_day"
      }
    },
    {
      "id": "jp.foundation-day",
      "title": "建国記念の日",
      "icon": "🎌",
      "categoryId": "le-chinh-thuc",
      "rule": {
        "kind": "solar_fixed",
        "month": 2,
        "day": 11
      },
      "effective": {
        "fromYear": 1966
      },
      "sourceIds": ["jp-cabinet-office"],
      "leavePolicy": {
        "kind": "same_day"
      }
    },
    {
      "id": "jp.emperors-birthday",
      "title": "天皇誕生日",
      "icon": "🎂",
      "categoryId": "le-chinh-thuc",
      "rule": {
        "kind": "solar_fixed",
        "month": 2,
        "day": 23
      },
      "effective": {
        "fromYear": 2020
      },
      "sourceIds": ["jp-cabinet-office"],
      "leavePolicy": {
        "kind": "same_day"
      }
    },
    {
      "id": "jp.vernal-equinox",
      "title": "春分の日",
      "icon": "🌸",
      "categoryId": "le-chinh-thuc",
      "rule": {
        "kind": "solar_fixed",
        "month": 3,
        "day": 20
      },
      "effective": {
        "fromYear": 1948
      },
      "sourceIds": ["jp-cabinet-office"],
      "leavePolicy": {
        "kind": "same_day"
      }
    },
    {
      "id": "jp.showa-day",
      "title": "昭和の日",
      "icon": "🌱",
      "categoryId": "le-chinh-thuc",
      "rule": {
        "kind": "solar_fixed",
        "month": 4,
        "day": 29
      },
      "effective": {
        "fromYear": 2007
      },
      "sourceIds": ["jp-cabinet-office"],
      "leavePolicy": {
        "kind": "same_day"
      }
    },
    {
      "id": "jp.constitution-day",
      "title": "憲法記念日",
      "icon": "📜",
      "categoryId": "le-chinh-thuc",
      "rule": {
        "kind": "solar_fixed",
        "month": 5,
        "day": 3
      },
      "effective": {
        "fromYear": 1948
      },
      "sourceIds": ["jp-cabinet-office"],
      "leavePolicy": {
        "kind": "same_day"
      }
    },
    {
      "id": "jp.greenery-day",
      "title": "みどりの日",
      "icon": "🌳",
      "categoryId": "le-chinh-thuc",
      "rule": {
        "kind": "solar_fixed",
        "month": 5,
        "day": 4
      },
      "effective": {
        "fromYear": 2007
      },
      "sourceIds": ["jp-cabinet-office"],
      "leavePolicy": {
        "kind": "same_day"
      }
    },
    {
      "id": "jp.childrens-day",
      "title": "こどもの日",
      "icon": "🎏",
      "categoryId": "le-chinh-thuc",
      "rule": {
        "kind": "solar_fixed",
        "month": 5,
        "day": 5
      },
      "effective": {
        "fromYear": 1948
      },
      "sourceIds": ["jp-cabinet-office"],
      "leavePolicy": {
        "kind": "same_day"
      }
    },
    {
      "id": "jp.marine-day",
      "title": "海の日",
      "icon": "🌊",
      "categoryId": "le-chinh-thuc",
      "rule": {
        "kind": "solar_nth_weekday",
        "month": 7,
        "weekday": 1,
        "occurrence": 3
      },
      "effective": {
        "fromYear": 2003
      },
      "sourceIds": ["jp-cabinet-office"],
      "leavePolicy": {
        "kind": "same_day"
      }
    },
    {
      "id": "jp.mountain-day",
      "title": "山の日",
      "icon": "⛰️",
      "categoryId": "le-chinh-thuc",
      "rule": {
        "kind": "solar_fixed",
        "month": 8,
        "day": 11
      },
      "effective": {
        "fromYear": 2016
      },
      "sourceIds": ["jp-cabinet-office"],
      "leavePolicy": {
        "kind": "same_day"
      }
    },
    {
      "id": "jp.respect-for-the-aged-day",
      "title": "敬老の日",
      "icon": "🧓",
      "categoryId": "le-chinh-thuc",
      "rule": {
        "kind": "solar_nth_weekday",
        "month": 9,
        "weekday": 1,
        "occurrence": 3
      },
      "effective": {
        "fromYear": 2003
      },
      "sourceIds": ["jp-cabinet-office"],
      "leavePolicy": {
        "kind": "same_day"
      }
    },
    {
      "id": "jp.autumnal-equinox",
      "title": "秋分の日",
      "icon": "🍁",
      "categoryId": "le-chinh-thuc",
      "rule": {
        "kind": "solar_fixed",
        "month": 9,
        "day": 23
      },
      "effective": {
        "fromYear": 1948
      },
      "sourceIds": ["jp-cabinet-office"],
      "leavePolicy": {
        "kind": "same_day"
      }
    },
    {
      "id": "jp.sports-day",
      "title": "スポーツの日",
      "icon": "🏃",
      "categoryId": "le-chinh-thuc",
      "rule": {
        "kind": "solar_nth_weekday",
        "month": 10,
        "weekday": 1,
        "occurrence": 2
      },
      "effective": {
        "fromYear": 2020
      },
      "sourceIds": ["jp-cabinet-office"],
      "leavePolicy": {
        "kind": "same_day"
      }
    },
    {
      "id": "jp.culture-day",
      "title": "文化の日",
      "icon": "🎭",
      "categoryId": "le-chinh-thuc",
      "rule": {
        "kind": "solar_fixed",
        "month": 11,
        "day": 3
      },
      "effective": {
        "fromYear": 1948
      },
      "sourceIds": ["jp-cabinet-office"],
      "leavePolicy": {
        "kind": "same_day"
      }
    },
    {
      "id": "jp.labor-thanksgiving-day",
      "title": "勤労感謝の日",
      "icon": "🌾",
      "categoryId": "le-chinh-thuc",
      "rule": {
        "kind": "solar_fixed",
        "month": 11,
        "day": 23
      },
      "effective": {
        "fromYear": 1948
      },
      "sourceIds": ["jp-cabinet-office"],
      "leavePolicy": {
        "kind": "same_day"
      }
    },
    {
      "id": "jp.substitute-holiday",
      "title": "振替休日",
      "icon": "🗓️",
      "categoryId": "le-chinh-thuc",
      "rule": {
        "kind": "solar_fixed",
        "month": 1,
        "day": 1
      },
      "effective": {
        "fromYear": 1973,
        "toYear": 1973
      },
      "sourceIds": ["jp-cabinet-office"],
      "leavePolicy": {
        "kind": "same_day"
      }
    },
    {
      "id": "jp.national-holiday",
      "title": "国民の休日",
      "icon": "🗓️",
      "categoryId": "le-chinh-thuc",
      "rule": {
        "kind": "solar_fixed",
        "month": 1,
        "day": 1
      },
      "effective": {
        "fromYear": 1985,
        "toYear": 1985
      },
      "sourceIds": ["jp-cabinet-office"],
      "leavePolicy": {
        "kind": "same_day"
      }
    }
  ]
}
