{
  "schemaVersion": 1,
  "documentType": "holiday_catalog",
  "jurisdiction": {
    "country": "VN",
    "subdivision": null
  },
  "kind": "official",
  "updatedAt": "2026-08-13T00:00:00Z",
  "sources": [
    {
      "id": "vn-labour-code-2012",
      "title": "Bộ luật Lao động số 10/2012/QH13",
      "authority": "Quốc hội",
      "url": "https://vanban.chinhphu.vn/default.aspx?docid=163542&pageid=27160",
      "publishedAt": "2012-06-18"
    },
    {
      "id": "vn-labour-code-2019",
      "title": "Bộ luật Lao động số 45/2019/QH14",
      "authority": "Quốc hội",
      "url": "https://vanban.chinhphu.vn/?classid=1&docid=198540&pageid=27160&typegroupid=3",
      "publishedAt": "2019-11-20"
    },
    {
      "id": "vn-cultural-development-resolution-2026",
      "title": "Nghị quyết số 28/2026/QH16 về phát triển văn hóa Việt Nam",
      "authority": "Quốc hội",
      "url": "https://moha.gov.vn/tin-tuc/quoc-hoi-chinh-thuc-thong-qua-nghi-quyet-ve-phat-trien-van-hoa-viet-nam-ngay-2411-la-ngay-van-hoa-viet-nam---id19441",
      "publishedAt": "2026-04-24"
    }
  ],
  "entries": [
    {
      "id": "vn.new-years-day",
      "title": "Tết Dương lịch",
      "icon": "🎆",
      "categoryId": "le-chinh-thuc",
      "rule": { "kind": "solar_fixed", "month": 1, "day": 1 },
      "effective": { "fromYear": 2013 },
      "sourceIds": ["vn-labour-code-2012", "vn-labour-code-2019"],
      "leavePolicy": { "kind": "same_day" }
    },
    {
      "id": "vn.lunar-new-year",
      "title": "Tết Nguyên Đán",
      "icon": "🧧",
      "categoryId": "le-chinh-thuc",
      "rule": {
        "kind": "lunar_fixed",
        "month": 1,
        "day": 1,
        "leapMonth": false
      },
      "effective": { "fromYear": 2013 },
      "sourceIds": ["vn-labour-code-2012", "vn-labour-code-2019"],
      "leavePolicy": { "kind": "annual_schedule_required", "statutoryDays": 5 }
    },
    {
      "id": "vn.hung-kings-commemoration",
      "title": "Giỗ Tổ Hùng Vương",
      "icon": "🏯",
      "categoryId": "le-chinh-thuc",
      "rule": {
        "kind": "lunar_fixed",
        "month": 3,
        "day": 10,
        "leapMonth": false
      },
      "effective": { "fromYear": 2013 },
      "sourceIds": ["vn-labour-code-2012", "vn-labour-code-2019"],
      "leavePolicy": { "kind": "same_day" }
    },
    {
      "id": "vn.reunification-day",
      "title": "Ngày Thống nhất đất nước",
      "icon": "🇻🇳",
      "categoryId": "le-chinh-thuc",
      "rule": { "kind": "solar_fixed", "month": 4, "day": 30 },
      "effective": { "fromYear": 2013 },
      "sourceIds": ["vn-labour-code-2012", "vn-labour-code-2019"],
      "leavePolicy": { "kind": "same_day" }
    },
    {
      "id": "vn.international-workers-day",
      "title": "Ngày Quốc tế Lao động",
      "icon": "👷",
      "categoryId": "le-chinh-thuc",
      "rule": { "kind": "solar_fixed", "month": 5, "day": 1 },
      "effective": { "fromYear": 2013 },
      "sourceIds": ["vn-labour-code-2012", "vn-labour-code-2019"],
      "leavePolicy": { "kind": "same_day" }
    },
    {
      "id": "vn.national-day-legacy",
      "title": "Quốc khánh Việt Nam",
      "icon": "🇻🇳",
      "categoryId": "le-chinh-thuc",
      "rule": { "kind": "solar_fixed", "month": 9, "day": 2 },
      "effective": { "fromYear": 2013, "toYear": 2020 },
      "sourceIds": ["vn-labour-code-2012"],
      "leavePolicy": { "kind": "same_day" }
    },
    {
      "id": "vn.national-day",
      "title": "Quốc khánh Việt Nam",
      "icon": "🇻🇳",
      "categoryId": "le-chinh-thuc",
      "rule": { "kind": "solar_fixed", "month": 9, "day": 2 },
      "effective": { "fromYear": 2021 },
      "sourceIds": ["vn-labour-code-2019"],
      "leavePolicy": {
        "kind": "annual_schedule_required",
        "statutoryDays": 2,
        "additionalDaySelection": "government_announced"
      }
    },
    {
      "id": "vn.vietnamese-culture-day",
      "title": "Ngày Văn hóa Việt Nam",
      "icon": "🎭",
      "categoryId": "le-chinh-thuc",
      "rule": { "kind": "solar_fixed", "month": 11, "day": 24 },
      "effective": { "fromYear": 2026 },
      "sourceIds": ["vn-cultural-development-resolution-2026"],
      "leavePolicy": { "kind": "same_day" }
    }
  ]
}
